{
  "schemaVersion": "1.0",
  "contractId": "travel-context-api-clarification-005",
  "change": "add-travel-context-and-account-preferences",
  "stage": "PRODUCT_SPEC",
  "role": "product_manager",
  "taskIds": [
    "3.4",
    "4.1",
    "5.1",
    "6.2"
  ],
  "requestFingerprint": "sha256:38838f9e12fb09651c8e844fd8903b5e75521519234784eb212a58e9337406a5",
  "status": "PASS",
  "modifiedFiles": [
    "openspec/changes/add-travel-context-and-account-preferences/design.md",
    "openspec/changes/add-travel-context-and-account-preferences/specs/backend-account-preferences/spec.md",
    "openspec/changes/add-travel-context-and-account-preferences/specs/frontend-account-settings/spec.md"
  ],
  "outputReferences": [
    "openspec/changes/add-travel-context-and-account-preferences/design.md",
    "openspec/changes/add-travel-context-and-account-preferences/specs/backend-account-preferences/spec.md",
    "openspec/changes/add-travel-context-and-account-preferences/specs/frontend-account-settings/spec.md"
  ],
  "verificationSummary": [
    {
      "command": "openspec status --change add-travel-context-and-account-preferences --json",
      "status": "PASS",
      "summary": "三个允许修改的 artifacts 均属于现有 existingOutputPaths，change 的 planning artifacts 完整。"
    },
    {
      "command": "rg -n -C 2 'DELETE /api/v1/accounts/me/travel-context|latestVersion|JSON 请求体|查询参数' <三个允许文件>",
      "status": "PASS",
      "summary": "三个 artifacts 已一致规定 DELETE 使用 ?version=N、无 JSON 请求体，并使用 ProblemDetail 扩展字段 latestVersion。"
    },
    {
      "command": "openspec validate add-travel-context-and-account-preferences --strict",
      "status": "PASS",
      "summary": "Change 'add-travel-context-and-account-preferences' is valid。"
    },
    {
      "command": "git diff --check",
      "status": "PASS",
      "summary": "命令退出码为 0，无已跟踪文件空白错误。"
    }
  ],
  "deviations": [],
  "blockers": [],
  "notRun": [
    "未运行 frontend/backend build、测试或实现验证；本合同只精化 planning artifacts，且禁止修改应用实现。"
  ],
  "residualRisks": [
    "整个活动 change 当前仍为未跟踪目录，普通 git diff --check 不覆盖其中未跟踪文件；OpenSpec strict validate 与定向内容检索已通过。",
    "下游 frontend/backend 合同必须消费本次更新后的 artifacts fingerprint。"
  ],
  "recommendations": [
    "向相关前后端实现合同同步 DELETE query 参数与 latestVersion 契约。",
    "后续 QA 覆盖 DELETE 无 JSON 请求体、version 查询参数，以及 PUT/DELETE 冲突响应 latestVersion。"
  ],
  "acceptance": {
    "status": "ACCEPTED",
    "evidenceRefs": [
      "requestFingerprint:sha256:cc49131a332fb2a462836f7ed3ae0cf161352793809fc8ee9c4b9d276870976f",
      "openspec validate add-travel-context-and-account-preferences --strict:PASS",
      "git diff --check:PASS"
    ]
  },
  "persistedBy": "main_agent"
}
