{
  "schemaVersion": "1.0",
  "contractId": "final-spec-findings-fix-001",
  "change": "enable-stage-isolated-subagent-orchestration",
  "stage": "CONTROL_PLANE_IMPLEMENTATION",
  "role": "main_agent",
  "taskIds": [
    "6.3"
  ],
  "requestFingerprint": "sha256:f5279259a74ad8440d9c8cd11116a78805f946053fb4c970f635b89a1f8baaad",
  "status": "PASS_WITH_ISSUES",
  "modifiedFiles": [
    ".codex/skills/chinamate-fullstack-delivery/scripts/validate_handoff_contract.py",
    ".codex/skills-lock.json"
  ],
  "outputReferences": [
    ".codex/skills/chinamate-fullstack-delivery/scripts/validate_handoff_contract.py",
    ".codex/skills-lock.json",
    "scripts/test-handoff-contracts.py"
  ],
  "verificationSummary": [
    {
      "command": "python3 -B scripts/test-handoff-contracts.py",
      "status": "PASS",
      "summary": "22/22 tests passed；新增 6 个 specialist 写入边界与 finding 绑定反例均已从 RED 转为 GREEN"
    },
    {
      "command": "python3 -B scripts/test-ai-delivery-governance.py",
      "status": "PASS",
      "summary": "14/14 tests passed；Skill computedHash/contentHash 与当前内容一致"
    },
    {
      "command": "python3 -B .codex/skills/chinamate-fullstack-delivery/scripts/validate_handoff_contract.py --change enable-stage-isolated-subagent-orchestration --all",
      "status": "PASS_WITH_ISSUES",
      "summary": "当前新修复 request 有效；全量历史快照准确返回 STALE：control-plane-red-tests-001 的测试输入及 final-spec-findings-red-001 的 validator 输入已因后续授权工作包变化，需由主 Agent在下游复核前显式重新验收"
    },
    {
      "command": "git diff --check -- .codex/skills/chinamate-fullstack-delivery/scripts/validate_handoff_contract.py .codex/skills-lock.json",
      "status": "PASS",
      "summary": "退出码 0，无 whitespace 错误"
    }
  ],
  "deviations": [],
  "blockers": [],
  "notRun": [],
  "residualRisks": [
    "控制面结果必须由 fresh qa_engineer 与 spec_reviewer 独立复核后才能验收",
    "两个历史 RED 合同的权威输入已因后续工作包按设计变为 STALE，主 Agent需基于当前事实显式重验，不能静默沿用旧 fingerprint",
    "机器门禁只证明结构、路径、fingerprint 与引用约束，不替代自然语言语义审查"
  ],
  "recommendations": [
    "先显式处理历史 STALE 快照，再签发引用本 ResultContract fingerprint 的 fresh QA 与 Spec Review 合同"
  ],
  "acceptance": {
    "status": "ACCEPTED",
    "evidenceRefs": [
      "openspec/changes/enable-stage-isolated-subagent-orchestration/handoffs/final-spec-findings-fix-001/reviews/final-fix-qa-001.json",
      "openspec/changes/enable-stage-isolated-subagent-orchestration/handoffs/final-spec-findings-fix-001/reviews/final-fix-spec-review-001.json",
      "main-agent-acceptance:2026-07-28"
    ]
  },
  "persistedBy": "main_agent"
}
