{
  "schemaVersion": "1.0",
  "contractId": "control-plane-implementation-001",
  "change": "enable-stage-isolated-subagent-orchestration",
  "stage": "CONTROL_PLANE_IMPLEMENTATION",
  "role": "main_agent",
  "taskIds": ["2.3", "3.1", "3.2", "4.1", "4.2"],
  "requestFingerprint": "sha256:8b7b08b185b512af9c9b2ddb4a789c94b353566228b45d8e8b590047ee69d3c4",
  "status": "PASS",
  "modifiedFiles": [
    ".codex/skills/chinamate-fullstack-delivery/SKILL.md",
    ".codex/skills/chinamate-fullstack-delivery/references/handoff-contracts.md",
    ".codex/skills/chinamate-fullstack-delivery/references/role-routing.md",
    ".codex/skills/chinamate-fullstack-delivery/references/stage-routing.md",
    ".codex/skills/chinamate-fullstack-delivery/references/control-matrix.md",
    ".codex/skills-lock.json",
    "README.md"
  ],
  "outputReferences": [
    ".codex/skills/chinamate-fullstack-delivery/references/handoff-contracts.md",
    ".codex/skills/chinamate-fullstack-delivery/references/role-routing.md",
    ".codex/skills/chinamate-fullstack-delivery/scripts/validate_handoff_contract.py",
    "scripts/test-handoff-contracts.py",
    "scripts/test-ai-delivery-governance.py"
  ],
  "verificationSummary": [
    {
      "command": "python3 -B scripts/test-handoff-contracts.py",
      "status": "PASS",
      "summary": "20/20 tests passed，包括控制面联合身份、gate、allowlist、Result 到 QA/Spec Review 与 correction 闭环"
    },
    {
      "command": "python3 -B scripts/test-ai-delivery-governance.py",
      "status": "PASS",
      "summary": "14/14 tests passed，七个 custom agents 保持不变且控制面未进入 specialist 路由集合"
    },
    {
      "command": "python3 -B .codex/skills/chinamate-fullstack-delivery/scripts/validate_handoff_contract.py --change enable-stage-isolated-subagent-orchestration --all",
      "status": "PASS",
      "summary": "5 个已持久化合同的结构、路径、fingerprint 与引用有效"
    },
    {
      "command": "git diff --check -- .codex/skills/chinamate-fullstack-delivery .codex/skills-lock.json README.md",
      "status": "PASS",
      "summary": "退出码为 0，无 whitespace 错误"
    }
  ],
  "deviations": [],
  "blockers": [],
  "notRun": [],
  "residualRisks": [
    "机器门禁只证明结构、路径、fingerprint 和引用约束，不替代独立语义审查",
    "本结果不包含合同签发前已完成的 schema/validator 自举改动"
  ],
  "recommendations": [
    "继续完成全 change 的 evidence、最终门禁与 task 6.3 审查"
  ],
  "acceptance": {
    "status": "ACCEPTED",
    "evidenceRefs": [
      "openspec/changes/enable-stage-isolated-subagent-orchestration/handoffs/control-plane-implementation-001/reviews/control-plane-qa-001.json",
      "openspec/changes/enable-stage-isolated-subagent-orchestration/handoffs/control-plane-implementation-001/reviews/control-plane-spec-review-001.json",
      "main-agent-reacceptance:acceptance-only:2026-07-28",
      "main-agent-reacceptance:final-task-checkboxes:2026-07-28"
    ]
  },
  "persistedBy": "main_agent"
}
